Date Seen,Title,Zach Rating,Zach Comments,Hayley Rating,Hayley Comments,Diff,Release,Director,Production Company,US Distribution,Length (Minutes),Lead Actors,Writers,Description
5/30/2020,The Joker,9,"In the midst of all the rioting and violence going on outside my window as well as a myriad of places in this country, this movie speaks volumes about how the issues people face are two directional. A mentally unstable person hurts the world just as much as the world is hurting them forming a cyclical pattern. This happens in more than the movies. Bullying, homelessness, racism, sexism.. all these things force eternal chaos and hatred. Something needs to break that cycle. From what I know of the DC comics, Batman can't even break that evil so I'm not sure what the 'hero'-less world can do besides keep trying to show compassion.",9,,0,10/4/2019,Todd Phillips,"Warner Bros. Pictures, DC Films",Warner Bros. Pictures,122,"Joaquin Phoenix, Robert De Niro, Zazie Beetz, Frances Conroy, Brett Cullen, Glenn Fleshler, Bill Camp, Shea Whigham, Marc Maron","Todd Phillips, Scott Silver","In Gotham City, mentally troubled comedian Arthur Fleck is disregarded and mistreated by society. He then embarks on a downward spiral of revolution and bloody crime. This path brings him face-to-face with his alter-ego: the Joker."
6/11/2020,The Hunger Games,8,"I mean, I've seen this movie so many time. I'm in it for peets sake. I can't give this movie below an 8 if they were nice enough to put my ugly mug in it. ",7,,1,3/23/2012,Gary Ross,Color Force,Lionsgate Films,142,"Jennifer Lawrence, Josh Hutcherson, Liam Hemsworth, Woody Harrelson, Elizabeth Banks, Lenny Kravitz, Stanley Tucci, Donald Sutherland","Suzanne Collins, Gary Ross, Billy Ray",Katniss Everdeen voluntarily takes her younger sister's place in the Hunger Games: a televised competition in which two teenagers from each of the twelve Districts of Panem are chosen at random to fight to the death.
6/14/2020,Twister,7,,N/A,,#VALUE!,5/10/1996,Jan de Bont,Warner Bros. Pictures,Warner Bros. Pictures,113,"Helen Hunt, Bill Paxton, Jami Gertz, Philip Seymour Hoffman, Cary Elwes","Michael Crichton, Anne-Marie Martin","Bill and Jo Harding, advanced storm chasers on the brink of divorce, must join together to create an advanced weather alert system by putting themselves in the cross-hairs of extremely violent tornadoes."
6/15/2020,The Hundred-Foot Journey,5,,6,,-1,8/8/2014,Lasse Hallström,DreamWorks Pictures,Walt Disney Studios Motion Pictures,122,"Helen Mirren, Om Puri, Manish Dayal, Charlotte Le Bon",Steven Knight,The Kadam family leaves India for France where they open a restaurant directly across the road from Madame Mallory's Michelin-starred eatery.
6/22/2020,The Hunger Games: Catching Fire,8,,8,,0,11/22/2013,Francis Lawrence,"Lionsgate Films, Color Force",Lionsgate Films,146,"Jennifer Lawrence, Josh Hutcherson, Liam Hemsworth, Woody Harrelson, Elizabeth Banks, Lenny Kravitz, Stanley Tucci, Donald Sutherland, Philip Seymour Hoffman, Jeffrey Wright","Simon Beaufoy, Michael deBruyn",Katniss Everdeen and Peeta Mellark become targets of the Capitol after their victory in the 74th Hunger Games sparks a rebellion in the Districts of Panem.
6/23/2020,The Hunger Games: Mockingjay Part 1,6,,6,,0,11/21/2014,Francis Lawrence,"Studio Babelsberg AG, Color Force",Lionsgate Films,123,"Jennifer Lawrence, Josh Hutcherson, Liam Hemsworth, Woody Harrelson, Elizabeth Banks, Julianne Moore, Stanley Tucci, Donald Sutherland, Philip Seymour Hoffman, Jeffrey Wright","Danny Strong, Peter Craig","Katniss Everdeen is in District 13 after she shatters the games forever. Under the leadership of President Coin and the advice of her trusted friends, Katniss spreads her wings as she fights to save Peeta and a nation moved by her courage."
6/27/2020,Psycho,8,,7,,1,9/8/1960,Alfred Hitchcock,Shamley Productions,Paramount Pictures,109,"Anthony Perkins, Vera Miles, John Gavin, Martin Balsam, John McIntire, Janet Leigh",Joseph Stefano,"A Phoenix secretary embezzles forty thousand dollars from her employer's client, goes on the run, and checks into a remote motel run by a young man under the domination of his mother."
6/28/2020,Baby Mama,N/A,,7,,#VALUE!,4/25/2008,Michael McCullers,Relativity Media,Universal Studios,99,"Tina Fey, Amy Poehler, Greg Kinnear, Dax Shepard, Romany Malco, Maura Tierney, Holland Taylor, Sigourney Weaver",Michael McCullers,"A successful, single businesswoman who dreams of having a baby discovers she is infertile and hires a working class woman to be her unlikely surrogate."
7/1/2020,The Court Jester,6,,4,,2,1/27/1956,"Melvin Frank, Normal Panama",Dena Enterprises,Paramount Pictures,101,"Danny Kaye, Glynis Johns, Basil Rathbone, Angela Lansbury, Cecil Parker","Melvin Frank, Norman Panama",A hapless carnival performer masquerades as the court jester as part of a plot against an evil ruler who has overthrown the rightful King.
7/2/2020,Ghostbusters,8,,7,,1,6/8/1984,Ivan Reitman,Columbia-Delphi Productions,Columbia Pictures,105,"Bill Murray, Dan Aykroyd, Sigourney Weaver, Harold Ramis, Rick Moranis","Dan Aykroyd, Harold Ramis",Three former parapsychology professors set up shop as a unique ghost removal service.
7/3/2020,Short Term 12,8,,7,,1,8/23/2013,Destin Daniel Cretton,Demarest Films,Cinedigm,96,"Brie Larson, John Gallagher, Jr., Kaitlyn Dever, Rami Malek, Lakeith Stanfield, Kevin Hernandez, Melora Walters, Stephanie Beatriz",Destin Daniel Cretton,A 20-something supervising staff member of a residential treatment facility navigates the troubled waters of that world alongside her co-worker and longtime boyfriend.
7/3/2020,Hamilton,6,,8,,-2,7/3/2020,Thomas Kail,Walt Disney Pictures,Walt Disney Studios Motion Pictures,160,"Daveed Diggs, Renée Elise Goldsberry, Jonathan Groff, Christopher Jackson, Jasmine Cephas Jones, Lin-Manuel Miranda, Leslie Odom Jr., Okieriete Onaodowan, Anthony Ramos, Phillipa Soo",Lin-Manuel Miranda,"The real life of one of America's foremost founding fathers and first Secretary of the Treasury, Alexander Hamilton. Captured live on Broadway from the Richard Rodgers Theater with the original Broadway cast."
7/8/2020,Eurovision Song Contest: The Story of Fire Saga,6,,6,"The movie was actually better than i thought throughout, but the movie ending was surprisingly enjoyable without the stereotypical ending. Also, the songs were good.",0,6/26/2020,David Dobkin,Gary Sanchez Productions,Netflix,123,"Will Ferrell, Rachel McAdams, Dan Stevens, Melissanthi Mahut, Mikael Persbrandt, Ólafur Darri Ólafsson, Graham Norton, Demi Lovato, Pierce Brosnan","Will Ferrell, Andrew Steele","When aspiring musicians Lars and Sigrit are given the opportunity to represent their country at the world's biggest song competition, they finally have a chance to prove that any dream worth having is a dream worth fighting for."
7/12/2020,Horrible Bosses,8,,8,,0,7/8/2011,Seth Gordon,New Line Cinema,Warner Bros. Pictures,98,"Jason Bateman, Charlie Day, Jason Sudeikis, Jennifer Aniston, Colin Farrell, Kevin Spacey, Jamie Foxx","Michael Markowitz, John Francis Daley, Jonathan Goldstein",Three friends conspire to murder their awful bosses when they realize they are standing in the way of their happiness.
7/13/2020,Palm Springs,9,,8,,1,7/10/2020,Max Barbakow,"Limelight Productions, Lonely Island Classics","NEON, Hulu",90,"Andy Samberg, Cristin Milioti, Peter Gallagher, J. K. Simmons",Andy Siara,"When carefree Nyles and reluctant maid of honor Sarah have a chance encounter at a Palm Springs wedding, things get complicated as they are unable to escape the venue, themselves, or each other."
7/17/2020,Ratatouille,9,,9,,0,6/29/2007,Brad Bird,"Walt Disney Pictures, Pixar Animation Studios",Buena Vista Pictures,111,"Patton Oswalt, Ian Holm, Lou Romano, Janeane Garofalo, Brad Garrett, Peter O'Toole, Brian Dennehy, Peter Sohn, Will Arnett",Brad Bird,A rat who can cook makes an unusual alliance with a young kitchen worker at a famous restaurant.
7/18/2020,The Biggest Little Farm,8,,7,,1,5/10/2019,John Chester,FarmLore Films,NEON,92,"John Chester, Molly Chester","John Chester, Mark Monroe",Documentarian John Chester and his wife Molly work to develop a sustainable farm on 200 acres outside of Los Angeles.
7/23/2020,Bohemian Rhapsody,9,,8,,1,11/2/2018,Bryan Singer,20th Century Fox,20th Century Fox,134,"Rami Malek, Lucy Boynton, Gwilym Lee, Ben Hardy, Joe Mazzello, Aidan Gillen, Tom Hollander, Allen Leech, Mike Myers",Anthony McCarten,"The story of the legendary British rock band Queen and lead singer Freddie Mercury, leading up to their famous performance at Live Aid (1985)."
7/24/2020,Pride & Prejudice,6,,8,,-2,11/11/2005,Joe Wright,Working Title Films,Focus Features,127,"Keira Knightley, Matthew Macfadyen, Brenda Blethyn, Donald Sutherland, Tom Hollander, Rosamund Pike, Jena Malone, Judi Dench",Deborah Moggach,"Sparks fly when spirited Elizabeth Bennet meets single, rich, and proud Mr. Darcy. But Mr. Darcy reluctantly finds himself falling in love with a woman beneath his class. Can each overcome their own pride and prejudice?"
7/27/2020,The Old Guard,8,,8,,0,7/10/2020,Gina Prince-Bythwood,"Skydance Media, Denver and Delilah Productions",Netflix,125,"Charlize Theron, KiKi Layne, Marwan Kenzari, Luca Marinelli, Harry Melling, Veronica Ngo, Matthias Schoenaerts, Chiwetel Ejiofor",Greg Rucka,A covert team of immortal mercenaries is suddenly exposed and must now fight to keep their identity a secret just as an unexpected new member is discovered.
8/1/2020,Athlete A,N/A,,7,,#VALUE!,6/24/2020,"Bonni Cohen, Jon Shenk",Actual Films,Netflix,104,,,Follow the Indianapolis Star reporters that broke the story about USA Gymnastics doctor Larry Nassar's abuse and hear from gymnasts like Maggie Nichols.
8/1/2020,It (Chapter 1),8,,8,,0,9/8/2017,Andy Muschietti,"New Line Cinema, KatzSmith Productions, Lin Pictures, Vertigo Entertainment",Warner Bros. Pictures,135,"Jaeden Lieberher, Bill Skarsgård, Jeremy Ray Taylor, Sophia Lillis, Finn Wolfhard, Wyatt Oleff, Chosen Jacobs, Jack Dylan Grazer, Nicholas Hamilton, Jackson Robert Scott","Chase Palmer, Cary Fukunaga, Gary Dauberman","In the summer of 1989, a group of bullied kids band together to destroy a shape-shifting monster, which disguises itself as a clown and preys on the children of Derry, their small Maine town."
8/1/2020,It: Chapter 2,6,,7,,-1,9/6/2019,Andy Muschietti,"New Line Cinema, Double Dream, Vertigo Entertainment, Rideback",Warner Bros. Pictures,169,"Jessica Chastain, James McAvoy, Bill Hader, Isaiah Mustafa, Jay Ryan, James Ransone, Andy Bean, Bill Skarsgård",Gary Dauberman,"Twenty-seven years after their first encounter with the terrifying Pennywise, the Losers Club have grown up and moved away, until a devastating phone call brings them back."
8/7/2020,Airplane!,5,,NA,,#VALUE!,7/2/1980,"Jim Abrahams, David Zucker, Jerry Zucker","Paramount Pictures, Howard W. Koch Productions",Paramount Pictures,87,"Robert Hays, Julie Hagerty, Leslie Nielsen, Robert Stack, Lloyd Bridges, Peter Graves, Kareem Abdul-Jabbar, Lorna Patterson","Jim Abrahams, David Zucker, Jerry Zucker",A man afraid to fly must ensure that a plane lands safely after the pilots become sick.
8/9/2020,Blackfish,N/A,,9,,#VALUE!,7/19/2013,Gabriela Cowperthwaite,CNN Films,Magnolia Pictures,83,,"Gabriela Cowperthwaite, Eli Despres, Tim Zimmermann","A documentary following the controversial captivity of killer whales, and its dangers for both humans and whales."
8/23/2020,The Wrong Missy,1,,3,,-2,5/13/2020,Tyler Spindel,Happy Madison Productions,Netflix,90,"David Spade, Lauren Lapkus, Nick Swardson, Geoff Pierson, Jackie Sandler, Sarah Chalke, Rob Schneider, Chris Witaske, Joe ""Roman Reigns"" Anoai, Molly Sims","Chris Pappas, Kevin Barnett","Tim thinks he's invited the woman of his dreams on a work retreat to Hawaii, realizing too late he mistakenly texted someone from a nightmare blind date."
8/26/2020,Batman Begins,7,,7,,0,6/15/2005,"Christopher Nolan, David S. Goyer","Warner Bros. Pictures, DC Films, Legendary Pictures, Syncopy",Warner Bros. Pictures,140,"Christian Bale, Michael Caine, Liam Neeson, Katie Holmes, Gary Oldman, Cillian Murphy, Tom Wilkinson, Rutger Hauer, Ken Watanabe, Morgan Freeman",David S. Goyer,"After training with his mentor, Batman begins his fight to free crime-ridden Gotham City from corruption."
8/28/2020,The Dark Knight,9,,9,,0,7/18/2008,Christopher Nolan,"Warner Bros. Pictures, DC Films, Legendary Pictures, Syncopy",Warner Bros. Pictures,152,"Christian Bale, Michael Caine, Heath Ledger, Gary Oldman, Aaron Eckhart, Maggie Gyllenhaal, Morgan Freeman","Jonathan Nolan, Christopher Nolan","When the menace known as the Joker wreaks havoc and chaos on the people of Gotham, Batman must accept one of the greatest psychological and physical tests of his ability to fight injustice."
8/29/2020,Pitch Perfect,5,,7,,-2,9/28/2012,Jason Moore,"Gold Circle Films, Brownstone Productions",Universal Pictures,112,"Anna Kendrick, Skylar Astin, Rebel Wilson, Adam DeVine, Anna Camp, Brittany Snow, John Michael Higgins, Elizabeth Banks",Kay Cannon,"Beca, a freshman at Barden University, is cajoled into joining The Bellas, her school's all-girls singing group. Injecting some much needed energy into their repertoire, The Bellas take on their male rivals in a campus competition."
8/30/2020,The Dark Knight Rises,8,,8,,0,7/20/2012,Christopher Nolan,"Warner Bros. Pictures, DC Films, Legendary Pictures, Syncopy",Warner Bros. Pictures,165,"Christian Bale, Michael Caine, Gary Oldman, Anne Hathaway, Tom Hardy, Marion Cotillard, Joseph Gordon-Levitt, Morgan Freeman","Jonathan Nolan, Christopher Nolan","Eight years after the Joker's reign of anarchy, Batman, with the help of the enigmatic Catwoman, is forced from his exile to save Gotham City from the brutal guerrilla terrorist Bane."
9/4/2020,Knock Down the House,7,,8,,-1,5/1/2019,Rachel Lears,"Jubilee Films, Atlas Films, Artemis Rising",Netflix,86,"Alexandria Ocasio-Cortez, Amy Vilela, Cori Bush, Paula Jean Swearengin","Rachel Lears, Robin Biotnick",A look at the people involved with various political campaigns during the 2018 U.S. congressional election.
9/5/2020,Eighth Grade,5,,6,,-1,7/13/2018,Bo Burnham,"A24, IAC Films, Scott Rudin Productions",A24,94,"Elsie Fisher, Josh Hamilton, Emily Robinson, Jake Ryan, Fred Hechinger",Bo Burnham,An introverted teenage girl tries to survive the last week of her disastrous eighth grade year before leaving to start high school.
9/6/2020,Gone Girl,8,,8,,0,10/3/2014,David Fincher,"Regency Enterprises, TSG Entertainment",20th Century Fox,149,"Ben Affleck, Rosamund Pike, Neil Patrick Harris, Tyler Perry, Carrie Coon, Kim Dickens",Gillian Flynn,"With his wife's disappearance having become the focus of an intense media circus, a man sees the spotlight turned on him when it's suspected that he may not be innocent."
9/7/2020,Tenet,8,,9,,-1,9/3/2020,Christopher Nolan,"Warner Bros. Pictures, Syncopy",Warner Bros. Pictures,140,"John David Washington, Robert Pattinson, Elizabeth Debicki, Dimple Kapadia, Michael Caine, Kenneth Branagh",Christopher Nolan,"Armed with only one word, Tenet, and fighting for the survival of the entire world, a Protagonist journeys through a twilight world of international espionage on a mission that will unfold in something beyond real time."
9/17/2020,The Social Dilemma,1,"This movie is lucky it didn't receive a 1. It's hypocritical by nature using scare tactics and clear generalized targeting to manipulate people. It also blames tech companies for issues of a full technological society. Yes, tech companies are an issue and tech addiction is seriously hurting our society, but the fantasy scenes and dark ominous sound effects detract from the truth of the problem. Data should be regulated and companies should be responsible for false information, but there are non-profit and private companies who cause many of these issues at the same societal rate as these large social network companies.",4,,-3,9/9/2020,Jeff Orlowski,"Exposure Labs, Argent Pictures, The Space Program",Netflix,94,"Tristan Harris, Aza Raskin, Justin Rosenstein, Shoshana Zuboff, Jaron Lanier, Skyler Gisondo, Kara Hayward, Vincent Kartheiser, Anna Lembke","Davis Coombe, Vickie Curtis, Jeff Orlowski","Explores the dangerous human impact of social networking, with tech experts sounding the alarm on their own creations."
9/18/2020,The Postcard Killings,5,,4,,1,3/13/2020,Danis Tanović,Good Films Collective,RLJE Films,104,"Jeffrey Dean Morgan, Famke Janssen, Cush Jumbo","Tove Alsterdal, Ellen Brown Furman, Liza Marklund, Andrew Stern, Tena Štivičić",A New York detective investigates the death of his daughter who was murdered while on her honeymoon in London; he recruits the help of a Scandinavian journalist when other couples throughout Europe suffer a similar fate.
9/19/2020,Anastasia,6,,7,,-1,11/21/1997,"Don Bluth, Gary Goldman","Fox Family Films, Fox Animation Studios",20th Century Fox,94,"Meg Ryan, John Cusack, Kelsey Grammer, Christopher Lloyd, Hank Azaria, Bernadette Peters, Kirsten Dunst, Angela Lansbury","Susan Gauthier, Bruce Graham, Bob Tzudiker, Noni White","The last surviving child of the Russian Royal Family joins two con men to reunite with her grandmother, the Dowager Empress, while the undead Rasputin seeks her death."
9/20/2020,Class Action Park,7,,7,,0,8/27/2020,"Seth Porges, Chris Charles Scott III","Pinball Party Productions, Strategy Films, Warner Max",HBO Max,90,,,A documentary that focuses on a dangerously legendary water park and its slew of injuries and crimes along with child safety concerns.
9/21/2020,Scott Pilgrim vs The World,8,,7,,1,8/13/2010,Edgar Wright,"Marc Platt Productions, Big Talk Films, Closed on Mondays Entertainment, Dentsu",Universal Pictures,112,"Michael Cera, Mary Elizabeth Winstead, Kieran Culkin, Chris Evans, Anna Kendrick, Alison Pill, Brandon Routh, Jason Schwartzman","Michael Bacall, Edgar Wright","In a magically realistic version of Toronto, a young man must defeat his new girlfriend's seven evil exes one by one in order to win her heart."
9/22/2020,The Impossible,7,,8,,-1,10/11/2012,J. A. Bayona,"Apaches Entertainment, Telecinco Cinema",Warner Bros. Pictures,113,"Naomi Watts, Ewan McGregor, Tom Holland","Sergio G. Sánchez, María Belón",The story of a tourist family in Thailand caught in the destruction and chaotic aftermath of the 2004 Indian Ocean tsunami.
9/23/2020,Enola Holmes,6,,5,,1,9/23/2020,Harry Bradbeer,"Legendary Pictures, PCMA Productions",Netflix,121,"Millie Bobby Brown, Sam Claflin, Henry Cavill, Helena Bonham Carter",Jack Thorne,"When Enola Holmes-Sherlock's teen sister-discovers her mother missing, she sets off to find her, becoming a super-sleuth in her own right as she outwits her famous brother and unravels a dangerous conspiracy around a mysterious young Lord."
9/24/2020,Forgetting Sarah Marshall,8,,8,,0,4/18/2008,Nicholas Stoller,Apatow Productions,Universal Pictures,111,"Jason Segel, Kristen Bell, Mila Kunis, Russell Brand",Jason Segel,"Devastated Peter takes a Hawaiian vacation in order to deal with the recent break-up with his TV star girlfriend, Sarah. Little does he know, Sarah's traveling to the same resort as her ex - and she's bringing along her new boyfriend."
9/24/2020,A Simple Favor,7,,6,,1,9/14/2018,Paul Feig,"Lionsgate Films, Feigco Entertainment, Bron Studios",Lionsgate Films,117,"Anna Kendrick, Blake Lively, Henry Golding, Andrew Rannells","Jessica Sharzer, Darcey Bell","Stephanie is a single mother with a parenting vlog who befriends Emily, a secretive upper-class woman who has a child at the same elementary school. When Emily goes missing, Stephanie takes it upon herself to investigate."
10/4/2020,Bumblebee,6,,5,,1,12/21/2018,Travis Knight,"Allspark Pictures, Di Bonaventura Pictures, Tencent Pictures",Paramount Pictures,114,"Hailee Steinfeld, John Cena, Jorge Lendeborg Jr., John Ortiz, Jason Drucker, Pamela Adlon",Christina Hodson,"On the run in the year 1987, Bumblebee finds refuge in a junkyard in a small California beach town. On the cusp of turning 18 and trying to find her place in the world, Charlie Watson discovers Bumblebee, battle-scarred and broken."
10/11/2020,Cabin in the Woods,9,,8,,1,4/13/2012,Drew Goddard,Mutant Enemy Productions,Lionsgate Films,95,"Kristen Connolly, Chris Hemsworth, Anna Hutchison, Fran Kranz, Jesse Williams, Richard Jenkins, Bradley Whitford","Joss Whedon, Drew Goddard","Five friends go for a break at a remote cabin, where they get more than they bargained for, discovering the truth behind the cabin in the woods."
10/12/2020,American Murder: The Family Next Door,N/A,,6,,#VALUE!,9/30/2020,Jenny Popplewell,Knickerbockerglory,Netflix,82,,,"In 2018, 34-year-old Shanann Watts and her two young daughters disappear in Colorado. With the heartbreaking details emerging, the family's story made headlines around the world."
10/17/2020,The Trial of the Chicago 7,N/A,,8,,#VALUE!,9/25/2020,Aaron Sorkin,"Paramount Pictures, DreamWorks Pictures, Cross Creek Pictures, Marc Platt Productions, ShivHans Pictures",Netflix,130,"Yahya Abdul-Mateen II, Sacha Baron Cohen, Daniel Flaherty, Joseph Gordon-Levitt, Michael Keaton, Frank Langella, John Carroll Lynch, Eddie Redmayne, Noah Robbins, Mark Rylance, Alex Sharp, Jeremy Strong",Aaron Sorkin,"The story of 7 people on trial stemming from various charges surrounding the uprising at the 1968 Democratic National Convention in Chicago, Illinois."
10/17/2020,Fighting with my Family,9,"I don't know what it was about this movie, but it got me ALL UP IN MY FEELING. The story was told in such a way that I was always cheering for Sariyah, I mean Paige. Maybe it's sports stories where the underdog comes out on top I don't know but I'm all for this movie.",N/A,,#VALUE!,2/14/2019,Stephen Merchant,"Metro-Goldwyn-Mayer, Film4, The Ink Factory, Seven Bucks Productions, Misher Films, WWE Studios",Mirror Releasing,108,"Florence Pugh, Lena Headey, Nick Frost, Jack Lowden, Vince Vaughn, Dwayne Johnson",Stephen Merchant,A former wrestler and his family make a living performing at small venues around the country while his kids dream of joining World Wrestling Entertainment.
10/24/2020,The Devil All the Time,6,,N/A,,#VALUE!,9/11/2020,Antonio Campos,"Nine Stories Productions, Bronx Moving Company",Netflix,139,"Tom Holland, Bill Skarsgård, Riley Keough, Jason Clarke, Sebastian Stan, Haley Bennett, Eliza Scanlen, Mia Wasikowska, Robert Pattinson","Antonio Campos, Paulo Campos",Sinister characters converge around a young man devoted to protecting those he loves in a postwar backwoods town teeming with corruption and brutality.
10/25/2020,Knives Out,N/A,,10,,#VALUE!,11/27/2019,Rian Johnson,"MRC, T-Street",Lionsgate Films,130,"Daniel Craig, Chris Evans, Ana de Armas, Jamie Lee Curtis, Michael Shannon, Don Johnson, Toni Collette, Lakeith Stanfield, Katherine Langford, Jaeden Martell, Christopher Plummer",Rian Johnson,"A detective investigates the death of a patriarch of an eccentric, combative family."
10/25/2020,Hocus Pocus,N/A,,7,,#VALUE!,7/16/1993,Kenny Ortega,Walt Disney Pictures,Buena Vista Pictures,96,"Bette Midler, Sarah Jessica Parker, Kathy Najimy, Omri Katz, Thora Birch, Vinessa Shaw","Mick Garris, Neil Cuthbert, David Kirschener","A curious youngster moves to Salem, where he struggles to fit in before awakening a trio of diabolical witches that were executed in the 17th century."
10/25/2020,Hush,7,"This sequel to Home Alone just isn't the same without McCullough Culkin.. it's not a sequel? oh that explains a lot. A lot of this movie seems illogical. The idea that a deaf woman would try to escape in a forrest from a guy with a crossbow rather than fight knife against knife inside her house seems stupid. She ultimately takes her cues from Culkin, but not soon enough in my opinion making this movie far too long!",N/A,,#VALUE!,4/8/2016,Mike Flanagan,"Blumhouse Productions, Intrepid Pictures",Netflix,81,"John Gallagher Jr., Michael Trucco, Kate Siegel","Mike Flanagan, Kate Siegel",A deaf and mute writer who retreated into the woods to live a solitary life must fight for her life in silence when a masked killer appears at her window.
10/29/2020,Spider-Man into the spider-verse,10,,N/A,,#VALUE!,12/14/2018,"Bob Persichetti, Peter Ramsey, Rodney Rothman","Columbia Pictures, Sony Pictures Animation, Marvel Entertainment, Arad Productions, Lord Miller Productions, Pascal Pictures",Sony Pictures Releasing,117,"Shameik Moore, Jake Johnson, Hailee Steinfeld, Mahershala Ali, Brian Tyree Henry, Lily Tomlin, Luna Lauren Velez, John Mulaney, Kimiko Glenn, Nicolas Cage, Liev Schreiber","Phil Lord, Stan Lee, Brian Michael Bendis, Sara Pichelli ","Teen Miles Morales becomes the Spider-Man of his universe, and must join with five spider-powered individuals from other dimensions to stop a threat for all realities."
10/30/2020,Clouds,N/A,,4,,#VALUE!,10/16/2020,Justin Baldoni,"Wayfarer Studios, Mad Chance Productions, La Scala Films",Disney+,121,"Fin Argus, Sabrina Carpenter, Madison Iseman, Lil Rel Howery, Tom Everett Scott, Neve Campbell","Kara Holden, Patrick Kopka, Casey La Scala","Young musician Zach Sobiech discovers his cancer has spread, leaving him just a few months to live. With limited time, he follows his dream and makes an album, unaware that it will soon be a viral music phenomenon."
10/31/2020,Interstellar,N/A,,9,,#VALUE!,11/5/2014,Christopher Nolan,"Paramount Pictures, Warner Bros. Pictures, Legendary Pictures, Syncopy, Lynda Obst Productions",Paramount Pictures,169,"Matthew McConaughey, Anne Hathaway, Jessica Chastain, Bill Irwin, Ellen Burstyn, Michael Caine","Jonathan Nolan, Christopher Nolan",A team of explorers travel through a wormhole in space in an attempt to ensure humanity's survival.
